{
  "schema": "plinth.family_invite/1",
  "code": "RC4-2MW",
  "link": "https://plinth.in/j/RC4-2MW",
  "expires_on": "2026-10-25",
  "scope_line": "4 projects: Aurelia Heights Ph 2, Kestrel Park, Sapphire Grove Ph 1 and Coral Towers",
  "share_text": "Rohan invited you to follow 4 projects on Plinth: Aurelia Heights Ph 2, Kestrel Park, Sapphire Grove Ph 1 and Coral Towers. You'll get the same alerts. Your number stays yours. Tap to join: plinth.in/j/RC4-2MW",
  "rules": ["Works for one person for 7 days.", "Carries no phone number."],
  "private_line": "Stays private to you: cost sheets, visit passes, payment alerts and who has your number."
}
