{
  "schema": "plinth.family_invite/1",
  "code": "AH2-7KQ",
  "link": "https://plinth.in/j/AH2-7KQ",
  "expires_on": "2026-10-25",
  "scope_line": "Aurelia Heights, Phase 2",
  "share_text": "Follow Aurelia Heights, Phase 2 with me on Plinth: https://plinth.in/j/AH2-7KQ",
  "rules": ["Works for one person for 7 days.", "Carries no phone number."],
  "private_line": "Stays private to you: cost sheets, visit passes, payment alerts and who has your number."
}
